{
  "version": "1.0.0",
  "metadata": {
    "timestamp": "2025-11-21T05:07:39.09784-06:00",
    "solver": "tsit5",
    "status": "success",
    "computeTime": 0.004927209
  },
  "model": {
    "name": "pc_small",
    "places": [
      "Buffer",
      "Consumed",
      "ConsumerReady",
      "ProducerReady"
    ],
    "transitions": [
      "consume",
      "produce"
    ],
    "arcs": 7
  },
  "simulation": {
    "timespan": [
      0,
      10
    ],
    "initialState": {
      "Buffer": 0,
      "Consumed": 0,
      "ConsumerReady": 1,
      "ProducerReady": 1
    },
    "rates": {
      "consume": 1,
      "produce": 1
    },
    "options": {
      "dt": 0.01,
      "abstol": 0.000001,
      "reltol": 0.001,
      "adaptive": true
    }
  },
  "results": {
    "summary": {
      "points": 747,
      "finalTime": 10,
      "finalState": {
        "Buffer": 0.9999546000701195,
        "Consumed": 9.000045399929895,
        "ConsumerReady": 1,
        "ProducerReady": 1
      }
    },
    "timeseries": {
      "time": {
        "full": [
          0,
          0.00003209139213665394,
          0.00006126167294945068,
          0.00008832742261697944,
          0.00011386291751760206,
          0.00013828380880014454,
          0.00016189840836996412,
          0.000184940270965984,
          0.00020758955978883453,
          0.00022998745802102927,
          0.0002522461390796708,
          0.0002744558236806502,
          0.00029668987907400125,
          0.00031900857288740187,
          0.000341461883253618,
          0.0003640916342712822,
          0.0003869331405775058,
          0.0004100164888928828,
          0.00043336754705105527,
          0.00045700876564587993,
          0.00048095981989925893,
          0.0005052381270534581,
          0.0005298592658315882,
          0.0005548373181792401,
          0.0005801851488608122,
          0.0006059146350380865,
          0.000632036855366147,
          0.0006585622461677445,
          0.0006855007307271394,
          0.0007128618265617543,
          0.0007406547346010407,
          0.0007688884134661642,
          0.0007975716414568866,
          0.0008267130683802629,
          0.0008563212589745961,
          0.0008864047293725699,
          0.0009169719777950812,
          0.0009480315104607264,
          0.0009795918635263285,
          0.0010116616217343357,
          0.0010442494343278234,
          0.001077364028698729,
          0.0011110142221562591,
          0.0011452089321372103,
          0.001179957185125881,
          0.001215268124506369,
          0.0012511510175327782,
          0.0012876152615718768,
          0.0013246703897469966,
          0.0013623260760905376,
          0.0014005921402946181,
          0.0014394785521345804,
          0.0014789954356277128,
          0.0015191530729792748,
          0.0015599619083593518,
          0.0016014325515469453,
          0.0016435757814717723,
          0.0016864025496793073,
          0.0017299239837404931,
          0.0017741513906241175,
          0.0018190962600470133,
          0.0018647702678148586,
          0.0019111852791643888,
          0.0019583533521161894,
          0.002006286740845872,
          0.002054997899080306,
          0.002104499483524636,
          0.0021548043573250304,
          0.002205925593571467,
          0.0022578764788443104,
          0.0023106705168080156,
          0.0023643214318548956,
          0.002418843172801619,
          0.0024742499166408344,
          0.0025305560723501274,
          0.002587776284760345,
          0.0026459254384851917,
          0.0027050186619138896,
          0.0027650713312686185,
          0.0028260990747283714,
          0.0028881177766208205,
          0.002951143581683744,
          0.0030151928993975364,
          0.003080282408390308,
          0.0031464290609170683,
          0.0032136500874144795,
          0.0032819630011326696,
          0.0033513856028456034,
          0.003421935985641514,
          0.0034936325397949106,
          0.0035664939577217045,
          0.0036405392390189946,
          0.003715787695591097,
          0.003792258956863408,
          0.0038699729750857293,
          0.003948950030726697,
          0.004029210737960994,
          0.004110776050251057,
          0.004193667266025006,
          0.00427790603445257,
          0.004363514361320813,
          0.004450514615011493,
          0.0045389295325819244,
          0.004628782225951261,
          0.004720096188194134,
          0.00481289529994364,
          0.004907203835905692,
          0.005003046471486804,
          0.005100448289537423,
          0.00519943478721294,
          0.0053000318829545855,
          0.005402265923592446,
          0.005506163691572883,
          0.005611752412312679,
          0.005719059761682308,
          0.005828113873620734,
          0.005938943347884241,
          0.006051577257931805,
          0.0061660451589496115,
          0.0062823770960173395,
          0.006400603612418919,
          0.006520755758100509,
          0.006642865098278508,
          0.0067669637222004635,
          0.006893084252061818,
          0.007021259852081486,
          0.007151524237739313,
          0.007283911685178555,
          0.007418457040776567,
          0.007555195730886954,
          0.007694163771756543,
          0.007835397779620553,
          0.007978934980979473,
          0.008124813223061196,
          0.00827307098447204,
          0.008423747386040398,
          0.008576882201856787,
          0.008732515870514225,
          0.008890689506552864,
          0.009051444912112993,
          0.009214824588800527,
          0.009380871749769249,
          0.009549630332024168,
          0.009721145008950412,
          0.009895461203072227,
          0.010072625099046727,
          0.010252683656897169,
          0.010435684625490597,
          0.010621676556264892,
          0.01081070881721027,
          0.011002831607110504,
          0.011198095970049183,
          0.011396553810186498,
          0.011598257906812145,
          0.01180326192968009,
          0.012011620454631071,
          0.01222338897950884,
          0.012438623940376318,
          0.012657382728037958,
          0.012879723704874802,
          0.013105706221998812,
          0.013335390636733302,
          0.01356883833042639,
          0.013806111726604599,
          0.0140472743094739,
          0.0142923906427757,
          0.014541526389005391,
          0.014794748329001382,
          0.015052124381912608,
          0.015313723625552821,
          0.015579616317150121,
          0.0158498739145004,
          0.016124569097533615,
          0.01640377579030206,
          0.016687569183399937,
          0.01697602575682394,
          0.01726922330328463,
          0.01756724095197879,
          0.017870159192833125,
          0.018178059901229983,
          0.01849102636322604,
          0.018809143301275207,
          0.019132496900467266,
          0.01946117483529413,
          0.019795266296955886,
          0.020134862021219085,
          0.02048005431684018,
          0.020830937094567268,
          0.021187605896733692,
          0.021550157927457448,
          0.021918692083460697,
          0.022293308985524098,
          0.022674111010591087,
          0.02306120232453765,
          0.02345468891562358,
          0.02385467862864164,
          0.02426128119978157,
          0.024674608292226285,
          0.025094773532498196,
          0.025521892547574025,
          0.02595608300278708,
          0.026397464640536453,
          0.02684615931982321,
          0.027302291056634235,
          0.027765986065194953,
          0.02823737280011286,
          0.028716581999434367,
          0.029203746728638166,
          0.029699002425589073,
          0.030202486946476932,
          0.030714340612765994,
          0.031234706259180896,
          0.03176372928275624,
          0.03230155769297748,
          0.0328483421630419,
          0.03340423608226901,
          0.03396939560969102,
          0.034543979728854715,
          0.035128150303867074,
          0.0357220721367182,
          0.03632591302591592,
          0.0369398438264677,
          0.037564038511246706,
          0.038198674233779734,
          0.038843931392496346,
          0.03949999369647957,
          0.04016704823275993,
          0.04084528553519595,
          0.041534899654985635,
          0.042236088232855094,
          0.04294905257297176,
          0.04367399771863146,
          0.0444103509369323,
          0.0451563314551815,
          0.04591044917717531,
          0.04667146898599633,
          0.04743837675508533,
          0.048210348016343836,
          0.0489867197458863,
          0.049766965400462555,
          0.05055067312852317,
          0.051337526955554075,
          0.052127290677563866,
          0.05291979417003267,
          0.05371492181816799,
          0.05451260278806361,
          0.05531280288053585,
          0.0561155177355,
          0.05692076718184323,
          0.05772859055406819,
          0.05853904282150751,
          0.059352191398134774,
          0.0601681135207409,
          0.060986894100526406,
          0.06180862396811926,
          0.06263339844486368,
          0.06346131618416544,
          0.06429247823595151,
          0.06512698729512753,
          0.06596494710149661,
          0.06680646196412018,
          0.06765163638771571,
          0.06850057478253802,
          0.06935338124239991,
          0.07021015937815804,
          0.07107101219620876,
          0.07193604201338011,
          0.0728053504011329,
          0.07367903815324875,
          0.07455720527222934,
          0.07543995097049662,
          0.07632737368319868,
          0.0772195710900158,
          0.07811664014384795,
          0.07901867710466548,
          0.07992577757713457,
          0.08083803655090005,
          0.08175554844263033,
          0.08267840713911173,
          0.08360670604082829,